{"schemaVersion":"1.0.0","journey":{"id":"golden-idea-release","golden":true},"metricContract":{"dictionaryVersion":"1.0.0","requiredMetricIds":["task-success-rate","time-savings-seconds","intervention-savings","creation-completion-rate","improvement-yield","regression-rate","recovery-rate","review-time-seconds","confidence-score","idea-to-release-candidate-credible-effectiveness"],"northStarMetricId":"idea-to-release-candidate-credible-effectiveness"},"privacy":{"processing":"local-only","participation":"opted-out"},"budget":{"maxDurationSeconds":3600,"maxCostUsd":10,"maxInterventions":2},"events":[],"evaluations":[],"evidence":[]}
